{
  "childProcessesDenied": true,
  "credentialsCleared": true,
  "environmentCleared": true,
  "executableDigest": "sha256:eeeeeeeeeeeeeeeeeeeeeeeeeeeeeeeeeeeeeeeeeeeeeeeeeeeeeeeeeeeeeeee",
  "inputReadOnly": true,
  "isolatedTemporaryStorage": true,
  "launcherId": "linux-sandbox-launcher",
  "launcherVersion": "1.0.0",
  "manifestDigest": "sha256:bbbbbbbbbbbbbbbbbbbbbbbbbbbbbbbbbbbbbbbbbbbbbbbbbbbbbbbbbbbbbbbb",
  "networkDenied": true,
  "opaqueHandlesOnly": true,
  "policyDigest": "sha256:ffffffffffffffffffffffffffffffffffffffffffffffffffffffffffffffff",
  "resourceLimitsEnforced": true,
  "schema": "fdir/adapter-sandbox-receipt/1",
  "workerId": "mock-python-worker"
}
